{
  "id": "tgt_01J9Z8Q2X4T5V6W7Y8Z9A0B1G7",
  "kind": "web-application",
  "identifier": "https://shop.example.com",
  "displayName": "Storefront",
  "hostnames": [
    "shop.example.com"
  ],
  "ipAddresses": [
    "203.0.113.10"
  ],
  "urls": [
    "https://shop.example.com"
  ],
  "ports": [
    {
      "from": 443,
      "to": 443
    }
  ],
  "protocols": [
    "tcp"
  ],
  "environment": "staging",
  "criticality": 4,
  "dataSensitivity": "confidential",
  "owner": "Web Platform Team",
  "tags": [
    "pci",
    "external"
  ],
  "attributes": {
    "stack": "nginx/1.25 + node 20",
    "waf": "cloudflare"
  }
}
